{
  "id": "kha.wk-sniper",
  "name": "Winter Korps Sniper",
  "faction": "kha",
  "type": "trooper",
  "keywords": [
    "winter-korps"
  ],
  "base": 30,
  "stats": {
    "SPD": 6,
    "MAT": 4,
    "RAT": 6,
    "DEF": 13,
    "ARM": 13
  },
  "damage": {
    "track": "single",
    "boxes": 1
  },
  "weapons": [
    {
      "weapon": "kha.w.hunting-rifle"
    },
    {
      "weapon": "kha.w.hand-weapon"
    }
  ],
  "abilities": [
    "core.a.advance-deployment",
    "kha.a.sniper"
  ],
  "cost": 0,
  "figure": {
    "archetype": "infantry"
  },
  "verify": "CD and WA agree: SPD 6 MAT 4 RAT 6 DEF 13 ARM 13, Hunting Rifle RNG 14 POW 10, Hand Weapon POW 9, 1 box, small base 30 mm, Advance Deployment, Sniper."
}
