{
  "faction": "cry",
  "id": "cry.furies",
  "name": "The Furies",
  "type": "unit",
  "character": true,
  "keywords": [
    "cryx",
    "necrofactorium",
    "undead",
    "wraith"
  ],
  "cost": 10,
  "fa": "C",
  "composition": {
    "grunts": {
      "profile": "cry.furies-a",
      "min": 1,
      "max": 1
    },
    "extra": [
      {
        "profile": "cry.furies-b",
        "min": 1,
        "max": 1
      },
      {
        "profile": "cry.furies-c",
        "min": 1,
        "max": 1
      }
    ],
    "costBySize": {
      "3": 10
    }
  }
}
