{
  "id": "cir.ravager-2",
  "name": "Ravager 2",
  "faction": "cir",
  "type": "trooper",
  "keywords": [
    "circle",
    "devourers-host",
    "tharn"
  ],
  "base": 40,
  "stats": {
    "SPD": 6,
    "MAT": 7,
    "RAT": 0,
    "DEF": 13,
    "ARM": 15
  },
  "damage": {
    "track": "single",
    "boxes": 8
  },
  "weapons": [
    {
      "weapon": "cir.w.tharn-axe"
    }
  ],
  "abilities": [
    "core.a.pathfinder",
    "core.a.tough",
    "cir.a.body-snatcher",
    "cir.a.blood-rage",
    "cir.a.meat-for-the-beast",
    "cir.a.meat-for-the-beast-damage",
    "cir.a.rapid-healing",
    "cir.a.treewalker",
    "cir.a.wraithbane-weapons"
  ],
  "cost": 0,
  "figure": {
    "archetype": "infantry"
  },
  "verify": "Stats, 8 boxes, 40 mm base and weapon match the app data (S1, S2). RAT 0 stands in for the blank RAT (no ranged weapon; the schema wants the stat)."
}
