{
  "id": "trl.krielstone",
  "name": "Krielstone Bearer & Stone Scribes",
  "faction": "trl",
  "type": "unit",
  "keywords": [
    "trollblood",
    "united-kriels",
    "trollkin",
    "krielstone"
  ],
  "cost": 5,
  "fa": 1,
  "composition": {
    "grunts": {
      "profile": "trl.stone-scribe",
      "min": 3,
      "max": 3
    },
    "extra": [
      {
        "profile": "trl.stone-bearer",
        "min": 1,
        "max": 1
      }
    ],
    "costBySize": {
      "4": 5
    }
  },
  "verify": "5 points, FA 1: S1, S10 and S2 agree. Unit size: S10 card cost line reads Stone Bearer and 3 Grunts; S2 lists 1 Stone Bearer and 3 Grunts. The Stone Scribe Elder command attachment is left out (RULING, 90 A.2)."
}
